{
  "units": "mm",
  "points": {
    "1": { "x": 0, "y": 0, "z": 0 },
    "2": { "x": 100, "y": 0, "z": 0 },
    "3": { "x": 50, "y": 100, "z": 0 },
    "4": { "x": 150, "y": 100, "z": 0 }
  },
  "lines": {
    "1": { "point-ids": [1, 2] },
    "2": { "point-ids": [1, 3] },
    "3": { "point-ids": [2, 3] },
    "4": { "point-ids": [2, 4] },
    "5": { "point-ids": [3, 4] }
  },
  "members-1d": {
    "1": {
      "line-id": 1,
      "material-id": 1,
      "cross-section-id": 1,
      "fem-type": "bar"
    },
    "2": {
      "line-id": 2,
      "material-id": 1,
      "cross-section-id": 1,
      "fem-type": "bar"
    },
    "3": {
      "line-id": 3,
      "material-id": 1,
      "cross-section-id": 1,
      "fem-type": "bar"
    },
    "4": {
      "line-id": 4,
      "material-id": 1,
      "cross-section-id": 1,
      "fem-type": "bar"
    },
    "5": {
      "line-id": 5,
      "material-id": 1,
      "cross-section-id": 1,
      "fem-type": "bar"
    }
  }
}
