{
  "$schema": "../json-schema/geometry.schema.json",
  "units": "mm",
  "points": {
    "point-1": { "x": 0, "y": 0, "z": 0 },
    "point-2": { "x": 100, "y": 0, "z": 0 },
    "point-3": { "x": 200, "y": 0, "z": 0 },
    "point-4": { "x": 50, "y": 0, "z": 100 },
    "point-5": { "x": 150, "y": 0, "z": 100 }
  },
  "lines": {
    "line-1": { "point-ids": ["point-1", "point-2"] },
    "line-2": { "point-ids": ["point-2", "point-3"] },
    "line-3": { "point-ids": ["point-4", "point-5"] },
    "line-4": { "point-ids": ["point-1", "point-4"] },
    "line-5": { "point-ids": ["point-4", "point-2"] },
    "line-6": { "point-ids": ["point-2", "point-5"] },
    "line-7": { "point-ids": ["point-5", "point-3"] }
  },
  "surfaces": {
    "surface-1": { "line-ids": ["line-1", "line-2", "line-3"] }
  },
  "volumes": {
    "volume-1": {
      "surface-ids": ["surface-1", "surface-1", "surface-1", "surface-1"]
    }
  },
  "members-1d": {
    "member-1d-1": {
      "line-id": 1,
      "material-id": 1,
      "cross-section-id": 1,
      "fem-type": "bar"
    },
    "2": {
      "line-id": 2,
      "material-id": 1,
      "cross-section-id": 1,
      "fem-type": "bar"
    },
    "3": {
      "line-id": 3,
      "material-id": 1,
      "cross-section-id": 1,
      "fem-type": "bar"
    },
    "4": {
      "line-id": 4,
      "material-id": 1,
      "cross-section-id": 1,
      "fem-type": "bar"
    },
    "5": {
      "line-id": 5,
      "material-id": 1,
      "cross-section-id": 1,
      "fem-type": "bar"
    },
    "6": {
      "line-id": 6,
      "material-id": 1,
      "cross-section-id": 1,
      "fem-type": "bar"
    },
    "7": {
      "line-id": 7,
      "material-id": 1,
      "cross-section-id": 1,
      "fem-type": "bar"
    }
  },
  "members-2d": {
    "1": {
      "surface-id": 1,
      "material-id": 1,
      "cross-sertion-id": 1,
      "fem-type": "plate"
    }
  },
  "members-3d": {
    "1": {
      "volume-id": 1,
      "material-id": 1
    }
  }
}
